{
  "$schema": "https://json-schema.org/draft/2020-12/schema",
  "$id": "https://probator.local/schemas/review-contract.schema.json",
  "title": "Probator review contract",
  "description": "The declarative half of an audit checker: everything that varies per reviewer, as data. The runtime (Rust) executes these verbs; the registry pins and versions the document. Judgment stays in policy.md - natural language is not part of this schema.",
  "type": "object",
  "required": ["name", "title", "domains", "finding_keys", "on", "severity", "tools", "task"],
  "additionalProperties": false,
  "allOf": [
    {"if": {"properties": {"tools": {"properties": {"full_service": {"const": true}}, "required": ["full_service"]}}, "required": ["tools"]},
     "then": {"required": ["snapshot"]}}
  ],
  "properties": {
    "name": {"type": "string", "pattern": "^[a-z0-9][a-z0-9-]{0,63}$"},
    "title": {"type": "string", "minLength": 1, "maxLength": 120},
    "summary": {"type": "string", "maxLength": 2000},
    "domains": {
      "type": "array", "minItems": 1, "uniqueItems": true,
      "items": {"type": "string", "pattern": "^[a-z0-9][a-z0-9_]{0,63}$"},
      "description": "The coverage contract: every submit accounts for each domain as reviewed / not-applicable / unknown."
    },
    "finding_keys": {
      "type": "array", "minItems": 1, "uniqueItems": true,
      "items": {"type": "string", "pattern": "^[a-z0-9][a-z0-9_]{0,63}$"},
      "allOf": [{"contains": {"const": "file"}}, {"contains": {"const": "line"}}, {"contains": {"const": "severity"}}],
      "description": "Every key a finding must carry, e.g. file/line/severity/evidence/impact/remedy/validation; Money Saver adds before_after and sources. file, line and severity are mandatory: the runtime validates every finding's path, positive line and severity enum."
    },
    "stage1": {
      "type": "object",
      "required": ["rules"],
      "additionalProperties": false,
      "properties": {
        "label": {"type": "string", "enum": ["deterministic", "static"]},
        "surfaces": {"type": "boolean", "default": false, "description": "Stage-1 summaries carry a surfaces list (path/line/rule notices short of refusal) that the inventory reply and the receipt echo (Security Enhancer)."},
        "refusal": {"type": "string", "minLength": 1, "maxLength": 300, "description": "The error a stage-one refusal raises; defaults to the deterministic audit's refusal."},
        "rules": {
          "type": "array", "maxItems": 64,
          "items": {
            "type": "object",
            "required": ["id", "title", "kind"],
            "additionalProperties": false,
            "properties": {
              "id": {"type": "string", "pattern": "^[a-z0-9][a-z0-9._/-]{0,63}$"},
              "title": {"type": "string", "minLength": 1, "maxLength": 160},
              "kind": {"type": "string", "enum": ["regex", "prompt", "builtin"]},
              "pattern": {"type": "string", "maxLength": 800, "description": "kind=regex: the deterministic pattern, run locally at zero token cost. An inline (?i) carries case-insensitivity."},
              "target": {"type": "string", "enum": ["revision-lines", "added-lines", "removed-lines", "changed-paths"], "description": "kind=regex: what the pattern applies to - every line of the reviewed revision, the added or removed diff lines, or the path names the review carries."},
              "prompt": {"type": "string", "maxLength": 4000, "description": "kind=prompt: a judgement the reviewer must make, surfaced as a checklist item."},
              "builtin": {"type": "string", "enum": ["withheld-names-and-credentials", "workspace-hygiene", "static-checklist", "dependency-direction"], "description": "kind=builtin: a deterministic check the runtime ships as code; declared by name so the contract never carries executable text. Each builtin owns one coupled scan pass whose hit ordering and refusal priority are its semantics."}
            },
            "allOf": [
              {"if": {"properties": {"kind": {"const": "regex"}}, "required": ["kind"]},
               "then": {"required": ["pattern", "target"], "properties": {"prompt": false, "builtin": false}}},
              {"if": {"properties": {"kind": {"const": "prompt"}}, "required": ["kind"]},
               "then": {"required": ["prompt"], "properties": {"pattern": false, "target": false, "builtin": false}}},
              {"if": {"properties": {"kind": {"const": "builtin"}}, "required": ["kind"]},
               "then": {"required": ["builtin"], "properties": {"pattern": false, "target": false, "prompt": false}}}
            ]
          }
        }
      }
    },
    "on": {
      "type": "array", "minItems": 1, "uniqueItems": true,
      "items": {"type": "string", "enum": ["pre-commit", "pre-push", "commit-msg", "prepare-commit-msg", "pre-applypatch", "pr", "release"]}
    },
    "severity": {"type": "string", "enum": ["blocking", "advisory"], "default": "blocking"},
    "tools": {
      "type": "object",
      "required": ["name_prefix", "context", "submit", "descriptions"],
      "additionalProperties": false,
      "properties": {
        "name_prefix": {"type": "string", "pattern": "^[a-z][a-z0-9_]{0,31}$", "description": "Tool names are derived: <prefix>_context, <prefix>_submit_review, <prefix>_official_doc. The prefix is data because the four published prefixes predate derivation and no rule reproduces them (sustainable-maintainer is 'maintainer')."},
        "context": {
          "type": "array", "minItems": 1, "uniqueItems": true,
          "items": {"type": "string", "enum": ["inventory", "original_request", "list", "diff", "read", "find"]},
          "description": "The evidence verbs this reviewer may call in gate mode."
        },
        "context_full_service": {
          "type": "array", "minItems": 1, "uniqueItems": true,
          "items": {"type": "string", "enum": ["inventory", "original_request", "list", "diff", "read", "find"]},
          "description": "The verb list in full-service mode when it differs from gate mode (Sustainable Maintainer drops diff and adds original_request). Requires full_service=true; defaults to context."
        },
        "submit": {"type": "boolean", "const": true},
        "official_documents": {"type": "boolean", "default": false, "description": "Whether the reviewer gets the catalogued official-document fetcher (Money Saver). Implies: the catalog in the inventory reply, findings' sources typed as catalogued URLs, submit validation that sources are fetched URLs and that applicable coverage cites at least one document, and the official_sources receipt field."},
        "full_service": {"type": "boolean", "default": false, "description": "Whether an operator-assigned snapshot review over selected projects is available beside the gate. Implies per-project coverage in the submit contract, keyed by the snapshot's project labels."},
        "projects_coverage": {"type": "string", "enum": ["full-service", "always"], "default": "full-service", "description": "When the per-project coverage property appears in the submit manifest: only in full-service mode, or whenever full_service is offered. 'always' keeps one submit schema shape in both modes (Money Saver); the property is required only in full-service mode either way. Requires full_service=true."},
        "domain_key": {"type": "string", "pattern": "^[a-z][a-z0-9_]{0,63}$", "default": "domains", "description": "The key the inventory reply carries the domains under (Money Saver: cost_domains)."},
        "revision_label": {"type": "string", "pattern": "^[a-z][a-z0-9_]{0,31}$", "default": "outgoing", "description": "The label the read operation uses for the reviewed end of the range (Money Saver: staged)."},
        "descriptions": {
          "type": "object",
          "required": ["context", "submit"],
          "additionalProperties": false,
          "properties": {
            "context": {"type": "string", "minLength": 1, "maxLength": 1200},
            "context_full_service": {"type": "string", "minLength": 1, "maxLength": 1200, "description": "The context tool's description in full-service mode; defaults to context."},
            "submit": {"type": "string", "minLength": 1, "maxLength": 600},
            "official_doc": {"type": "string", "minLength": 1, "maxLength": 600, "description": "Required iff official_documents=true."},
            "inventory_full_service": {"type": "string", "minLength": 1, "maxLength": 1200, "description": "The inventory reply's instruction text in full-service mode; requires full_service=true."}
          },
          "description": "The model-facing tool descriptions. {read_page_lines}, {diff_page_chars} and {find_page} placeholders are filled by the runtime, so a page-size change cannot leave a description promising a page the code no longer serves."
        }
      }
    },
    "finding_optional_keys": {
      "type": "array", "uniqueItems": true,
      "items": {"type": "string", "pattern": "^[a-z0-9][a-z0-9_]{0,63}$"},
      "description": "Finding properties accepted but not required, typed as plain strings (Money Saver: title). They must not duplicate finding_keys. A finding key named 'sources' under tools.official_documents=true is instead typed as a list of catalogued URLs."
    },
    "task": {"type": "string", "minLength": 1, "maxLength": 4000, "description": "The instruction template the runtime prepends to the review conversation; {placeholders} name runtime facts, never repository content."},
    "task_full_service": {"type": "string", "minLength": 1, "maxLength": 4000, "description": "The instruction template in full-service mode; defaults to task."},
    "snapshot": {
      "type": "object",
      "required": ["suffixes", "manifests"],
      "additionalProperties": false,
      "properties": {
        "suffixes": {"type": "array", "minItems": 1, "uniqueItems": true, "items": {"type": "string", "pattern": "^\\.[a-z0-9]+$"}, "description": "Source suffixes the snapshot includes."},
        "manifests": {"type": "array", "minItems": 1, "uniqueItems": true, "items": {"type": "string", "pattern": "^[A-Za-z0-9_.-]+$"}, "description": "Exact file names the snapshot includes regardless of suffix."},
        "exclude_names": {"type": "array", "uniqueItems": true, "items": {"type": "string", "pattern": "^[A-Za-z0-9_.-]+$"}, "description": "Exact base names excluded beyond the engine's shared hygiene set (Sustainable Maintainer excludes lockfiles: generated integrity data, not reviewable structure)."}
      },
      "description": "The file contract of a full-service snapshot: which files the reviewer may read. Requires tools.full_service=true. The runtime's shared hygiene (vendored/build/cache directories, generated suffixes, the sensitive-path contract) always applies and is not repeated here."
    },
    "runtime": {"$ref": "#/$defs/runtime"}
  },
  "$defs": {
    "runtime": {
      "type": "object",
      "required": ["harness", "provider", "model"],
      "additionalProperties": false,
      "properties": {
        "harness": {"type": "string", "pattern": "^[A-Za-z0-9._-]+$", "description": "The agent spec id the review runs on - an inert label."},
        "provider": {"type": "string", "pattern": "^[A-Za-z0-9._-]+$", "description": "The provider namespace every model entry must sit in; the runtime checks each model carries this prefix."},
        "model": {"type": "string", "pattern": "^[a-zA-Z0-9._-]+/[A-Za-z0-9][A-Za-z0-9._:/+-]{0,79}$", "description": "The provider-prefixed model label; the runtime requires the prefix to equal `provider`."},
        "fallback_models": {"type": "array", "items": {"type": "string", "pattern": "^[a-zA-Z0-9._-]+/[A-Za-z0-9][A-Za-z0-9._:/+-]{0,79}$"}, "description": "Ordered same-agent model fallbacks behind `model`; the audit session steps down this list when the active model cannot serve the turn."},
        "windows": {
          "type": "array",
          "items": {
            "type": "object",
            "required": ["timezone", "from", "to"],
            "additionalProperties": false,
            "properties": {
              "timezone": {"type": "string", "pattern": "^[A-Za-z0-9/_-]+$", "description": "IANA zone name, e.g. \"Asia/Shanghai\"."},
              "from": {"type": "string", "pattern": "^([01][0-9]|2[0-3]):[0-5][0-9]$", "description": "Window start, \"HH:MM\"; may wrap midnight with `to`."},
              "to": {"type": "string", "pattern": "^([01][0-9]|2[0-3]):[0-5][0-9]$", "description": "Window end, \"HH:MM\"."},
              "model": {"type": "string", "pattern": "^[a-zA-Z0-9._-]+/[A-Za-z0-9][A-Za-z0-9._:/+-]{0,79}$"},
              "models": {"type": "array", "items": {"type": "string", "pattern": "^[a-zA-Z0-9._-]+/[A-Za-z0-9][A-Za-z0-9._:/+-]{0,79}$"}}
            }
          },
          "description": "Ordered peak/off-peak windows: the first window covering now leads the effective model chain; the declared chain trails."
        },
        "retry": {
          "type": "object",
          "additionalProperties": false,
          "properties": {
            "interval": {"type": "string", "description": "Poll interval for an unknown reset window - a jiff duration string (\"30m\", \"PT1H\")."},
            "reset_grace": {"type": "string", "description": "Grace added to a known reset instant - a jiff duration string (\"3h01m\")."}
          },
          "description": "Quota-recovery schedule handed to the orchestrator; each field validates as a jiff duration."
        },
        "effort": {"type": "string", "pattern": "^[A-Za-z0-9][A-Za-z0-9._:/+-]{0,79}$", "description": "Declarative reasoning-effort label passed through to the lane; optional."}
      },
      "description": "Inert labels only - never a command, path or endpoint. The runtime rejects anything outside the declared set."
    }
  }
}
