{
  "name": "security-enhancer",
  "title": "Security Enhancer",
  "summary": "Pre-release hardening gate: supply chain, CI authority, secret handling, transport, authorization defaults, containers and release artifacts.",
  "domains": [
    "dependency_supply_chain",
    "ci_workflow_authority",
    "secret_handling",
    "transport_security",
    "authz_defaults",
    "container_runtime",
    "release_artifacts"
  ],
  "finding_keys": [
    "file",
    "line",
    "severity",
    "evidence",
    "impact",
    "remedy",
    "validation"
  ],
  "stage1": {
    "label": "static",
    "surfaces": true,
    "refusal": "The static security checklist refused this operation; nothing was published",
    "rules": [
      {
        "id": "security-static-checklist",
        "title": "The static security checklist over the outgoing revision",
        "kind": "builtin",
        "builtin": "static-checklist"
      },
      {
        "id": "protection-surface-self-mutation",
        "title": "Repository content must not write to its own protection surface",
        "kind": "regex",
        "target": "revision-lines",
        "pattern": "(?i)(-X\\s*(patch|put|post|delete)\\b.{0,140}(rulesets|branches/[^\\s\"']+/protection|actions/(permissions|secrets|variables)|environments/[^\\s\"']+/protection)|(createRepo[R]uleset|updateRepo[R]uleset|deleteRepo[R]uleset|updateBranch[P]rotection|deleteBranch[P]rotection|createOrUpdateRepo[S]ecret|deleteRepo[S]ecret|createOrUpdateRepo[V]ariable|updateRepo[V]ariable|deleteRepo[V]ariable)\\b|\\br[R]ulesets?\\w*\\b.{0,40}\\b(apply|enforce|patch|disable|delete)\\b)"
      },
      {
        "id": "protection-surface-authority",
        "title": "The protected object must not carry its own protection controls",
        "kind": "prompt",
        "prompt": "The outgoing tree may not contain mutation paths to the repository's own publication or protection surface - rulesets, branch protection, Actions permissions, secrets or variables administration, environment protection or workflow self-amendment beyond review. Read-only verification may name the surface it checks; mutation belongs to the operator outside the checkout. Judge every file and workflow in the revision, including builder-style code that constructs the write across lines."
      }
    ]
  },
  "on": [
    "pre-push",
    "pr",
    "release"
  ],
  "severity": "blocking",
  "tools": {
    "name_prefix": "security",
    "context": [
      "inventory",
      "list",
      "diff",
      "read",
      "find"
    ],
    "submit": true,
    "descriptions": {
      "context": "Inspect the immutable outgoing range. Start with inventory (it lists the surfaces the static stage already reported), then diff every changed file to its end; read is {read_page_lines} lines with start; find is a literal search over the range. Credential containers are unavailable by design.",
      "submit": "Submit the final hardening verdict once, with all seven domains accounted for."
    }
  },
  "task": "Review the outgoing changes with the Security Enhancer tools and submit one final verdict: start with inventory, read every changed diff to its end, judge all seven domains, and account for every surface the static stage reported. No arbitrary turn or time limit applies."
}
